rank,year,duration,age_limit,rating,numberof_ratings,Metascore,storyline,movie_name,processed_storyline
707,1948,2h 13m,U,7.8,(35K),96.0,"Dunson leads a cattle drive, the culmination of over 14 years of work, to its destination in Missouri. But his tyrannical behavior along the way causes a mutiny, led by his adopted son.", Red River,dunson leads a cattle drive the culmination of over years of work to its destination in missouri but his tyrannical behavior along the way causes a mutiny led by his adopted son
708,1973,2h 23m,A,7.8,(45K),80.0,"In the aftermath of France allowing Algeria's independence, a group of resentful military veterans hire a professional assassin codenamed ""Jackal"" to kill President Charles de Gaulle.", The Day of the Jackal,in the aftermath of france allowing algerias independence a group of resentful military veterans hire a professional assassin codenamed jackal to kill president charles de gaulle
709,1944,1h 54m,PG,7.8,(34K),78.0,"Ten years after her aunt was murdered in their London home, a woman returns from Italy in the 1880s to resume residence with her new husband. His obsessive interest in the home rises from a secret that may require driving his wife insane.", Gaslight,ten years after her aunt was murdered in their london home a woman returns from italy in the s to resume residence with her new husband his obsessive interest in the home rises from a secret that may require driving his wife insane
710,1979,2h 3m,X,7.8,(36K),72.0,"Director/choreographer Bob Fosse tells his own life story as he details the sordid career of Joe Gideon, a womanizing, drug-using dancer.", All That Jazz,directorchoreographer bob fosse tells his own life story as he details the sordid career of joe gideon a womanizing drugusing dancer
711,2002,1h 49m,18,7.8,(50K),83.0,"Sixteen-year-old Lilja and her only friend, the young boy Volodja, live in Russia, fantasizing about a better life. One day, Lilja falls in love with Andrej, who is going to Sweden, and invites Lilja to come along and start a new life.", Lilya 4-Ever,sixteenyearold lilja and her only friend the young boy volodja live in russia fantasizing about a better life one day lilja falls in love with andrej who is going to sweden and invites lilja to come along and start a new life
712,1995,1h 51m,U,7.8,(73K),75.0,"A love story between a girl who loves reading books, and a boy who has previously checked out all of the library books she chooses.", Whisper of the Heart,a love story between a girl who loves reading books and a boy who has previously checked out all of the library books she chooses
713,2006,2h 21m,15,7.8,(171K),89.0,"The story of the battle of Iwo Jima between the United States and Imperial Japan during World War II, as told from the perspective of the Japanese who fought it.", Letters from Iwo Jima,the story of the battle of iwo jima between the united states and imperial japan during world war ii as told from the perspective of the japanese who fought it
714,1931,1h 10m,PG,7.8,(80K),91.0,Dr Henry Frankenstein is obsessed with assembling a living being from parts of several exhumed corpses., Frankenstein,dr henry frankenstein is obsessed with assembling a living being from parts of several exhumed corpses
715,1996,2h 39m,18,7.8,(72K),82.0,"Oilman Jan is paralyzed in an accident. His wife, who prayed for his return, feels guilty; even more, when Jan urges her to have sex with another.", Breaking the Waves,oilman jan is paralyzed in an accident his wife who prayed for his return feels guilty even more when jan urges her to have sex with another
716,1975,2h 9m,PG,7.8,(52K),91.0,"In 1880s India, two former British soldiers decide to set themselves up as Kings in Kafiristan, a land where no white man has set foot since Alexander the Great.", The Man Who Would Be King,in s india two former british soldiers decide to set themselves up as kings in kafiristan a land where no white man has set foot since alexander the great
717,2007,1h 26m,15,7.8,(122K),90.0,"A modern-day musical about a busker and an immigrant and their eventful week in Dublin, as they write, rehearse and record songs that tell their love story.", Once,a modernday musical about a busker and an immigrant and their eventful week in dublin as they write rehearse and record songs that tell their love story
718,1972,1h 35m,PG,7.8,(63K),,"In the 16th century, the ruthless and insane Don Lope de Aguirre leads a Spanish expedition in search of El Dorado."," Aguirre, the Wrath of God",in the th century the ruthless and insane don lope de aguirre leads a spanish expedition in search of el dorado
719,2008,2h 5m,18,7.8,(73K),64.0,A disgraced ex-policeman who runs a small ring of prostitutes finds himself in a race against time when one of his women goes missing., The Chaser,a disgraced expoliceman who runs a small ring of prostitutes finds himself in a race against time when one of his women goes missing
720,1932,1h 4m,Rejected,7.8,(51K),80.0,"A circus' beautiful trapeze artist Cleopatra agrees to marry Hans the leader of side-show performers, but Hans' deformed friends discover that she is only marrying him for his inheritance. So they seek revenge.", Freaks,a circus beautiful trapeze artist cleopatra agrees to marry hans the leader of sideshow performers but hans deformed friends discover that she is only marrying him for his inheritance so they seek revenge
721,1999,1h 41m,15,7.8,(103K),87.0,"A comedy-drama about a bereaved mother, an overwrought actress, her jealous lover, and a pregnant nun.", All About My Mother,a comedydrama about a bereaved mother an overwrought actress her jealous lover and a pregnant nun
722,2017,1h 34m,12A,7.8,(64K),62.0,"In a story depicted in oil painted animation, a young man comes to the last hometown of painter Vincent van Gogh to deliver the troubled artist's final letter and ends up investigating his final days there.", Loving Vincent,in a story depicted in oil painted animation a young man comes to the last hometown of painter vincent van gogh to deliver the troubled artists final letter and ends up investigating his final days there
723,1993,1h 34m,15,7.8,(111K),87.0,A woman struggles to find a way to live her life after the death of her husband and child., Three Colors: Blue,a woman struggles to find a way to live her life after the death of her husband and child
724,1955,1h 58m,PG,7.8,(49K),72.0,"Two brothers in 1910s California struggle to maintain their strict, Bible-toting father's favor as an old secret about their long-absent mother comes to light.", East of Eden,two brothers in s california struggle to maintain their strict bibletoting fathers favor as an old secret about their longabsent mother comes to light
725,1993,1h 34m,18,7.8,(41K),,A vagabond swordsman is aided by a kunoichi and a spy in battling a demonic clan of killers - led by a ghost from his past - who are bent on overthrowing the Tokugawa Shogunate., Ninja Scroll,a vagabond swordsman is aided by a kunoichi and a spy in battling a demonic clan of killers led by a ghost from his past who are bent on overthrowing the tokugawa shogunate
726,1950,1h 52m,PG,7.8,(30K),85.0,"A major heist goes off as planned, but then double crosses, bad luck and solid police work cause everything to unravel.", The Asphalt Jungle,a major heist goes off as planned but then double crosses bad luck and solid police work cause everything to unravel
727,1986,1h 47m,15,7.8,(77K),90.0,"Between two Thanksgivings two years apart, Hannah's husband falls in love with her sister Lee, while her hypochondriac ex-husband rekindles his relationship with her sister Holly.", Hannah and Her Sisters,between two thanksgivings two years apart hannahs husband falls in love with her sister lee while her hypochondriac exhusband rekindles his relationship with her sister holly
728,2009,2h 24m,15,7.8,(78K),84.0,"Strange events happen in a small village in the north of Germany during the years before World War I, which seem to be ritual punishment. Who is responsible?", The White Ribbon,strange events happen in a small village in the north of germany during the years before world war i which seem to be ritual punishment who is responsible
729,2013,1h 44m,PG,7.8,(61K),76.0,A mistaken delivery in Mumbai's famously efficient lunchbox delivery system connects a young housewife to an older man in the dusk of his life as they build a fantasy world together through notes in the lunchbox., The Lunchbox,a mistaken delivery in mumbais famously efficient lunchbox delivery system connects a young housewife to an older man in the dusk of his life as they build a fantasy world together through notes in the lunchbox
730,1943,1h 48m,PG,7.8,(71K),94.0,"A teenage girl, overjoyed when her favorite uncle comes to visit the family in their quiet California town, slowly begins to suspect that he is in fact the ""Merry Widow"" killer sought by the authorities.", Shadow of a Doubt,a teenage girl overjoyed when her favorite uncle comes to visit the family in their quiet california town slowly begins to suspect that he is in fact the merry widow killer sought by the authorities
731,1993,1h 16m,PG,7.8,(57K),65.0,Batman is wrongly implicated in a series of murders of mob bosses actually committed by a new vigilante assassin., Batman: Mask of the Phantasm,batman is wrongly implicated in a series of murders of mob bosses actually committed by a new vigilante assassin
732,1935,1h 15m,PG,7.8,(53K),95.0,"Mary Shelley reveals the main characters of her novel survived: Baron Henry Frankenstein, goaded by an even madder scientist, builds his monster a mate.", Bride of Frankenstein,mary shelley reveals the main characters of her novel survived baron henry frankenstein goaded by an even madder scientist builds his monster a mate
733,1940,1h 32m,PG,7.8,(63K),,A newspaper editor uses every trick in the book to keep his ace reporter ex-wife from remarrying., His Girl Friday,a newspaper editor uses every trick in the book to keep his ace reporter exwife from remarrying
734,2009,2h 35m,18,7.8,(103K),90.0,A delinquent Muslim man struggles to get by in prison until he is taken under the wing of a powerful mob boss. But his gradual rise through the mob's ranks brings him in conflict with his mentor., A Prophet,a delinquent muslim man struggles to get by in prison until he is taken under the wing of a powerful mob boss but his gradual rise through the mobs ranks brings him in conflict with his mentor
735,1944,1h 40m,Approved,7.8,(38K),90.0,"During World War II, American expatriate Harry Morgan helps transport a French Resistance leader and his beautiful wife to Martinique while romancing a sensuous lounge singer.", To Have and Have Not,during world war ii american expatriate harry morgan helps transport a french resistance leader and his beautiful wife to martinique while romancing a sensuous lounge singer
736,1964,1h 31m,A,7.8,(32K),86.0,A young woman separated from her lover by war faces a life-altering decision., The Umbrellas of Cherbourg,a young woman separated from her lover by war faces a lifealtering decision
737,1938,1h 42m,Approved,7.8,(66K),91.0,"While trying to secure a $1 million donation for his museum, a befuddled paleontologist is pursued by a flighty and often irritating heiress and her pet leopard, Baby.", Bringing Up Baby,while trying to secure a million donation for his museum a befuddled paleontologist is pursued by a flighty and often irritating heiress and her pet leopard baby
738,1962,1h 30m,PG,7.8,(28K),87.0,"Cleo, a singer and hypochondriac, becomes increasingly worried that she might have cancer while awaiting test results from her doctor.", ClÃ©o from 5 to 7,cleo a singer and hypochondriac becomes increasingly worried that she might have cancer while awaiting test results from her doctor
739,2003,1h 28m,12,7.8,(47K),75.0,"On Christmas Eve, three homeless people living on the streets of Tokyo discover a newborn baby among the trash and set out to find its parents.", Tokyo Godfathers,on christmas eve three homeless people living on the streets of tokyo discover a newborn baby among the trash and set out to find its parents
740,1961,1h 40m,X,7.8,(33K),88.0,A young governess for two children becomes convinced that the house and grounds are haunted., The Innocents,a young governess for two children becomes convinced that the house and grounds are haunted
741,2001,1h 55m,12A,7.8,(53K),62.0,"A terrorist explosion releases a deadly virus on the masses, and it's up to the bounty-hunting Bebop crew to catch the cold-blooded culprit.", Cowboy Bebop: The Movie,a terrorist explosion releases a deadly virus on the masses and its up to the bountyhunting bebop crew to catch the coldblooded culprit
742,1994,1h 48m,U,7.8,(39K),81.0,"A simple Italian postman learns to love poetry while delivering mail to a famous poet, and then uses this to woo local beauty Beatrice.", The Postman,a simple italian postman learns to love poetry while delivering mail to a famous poet and then uses this to woo local beauty beatrice
743,2004,1h 37m,12A,7.8,(67K),56.0,"Pierre, a successful orchestra conductor, returns home when his mother dies. He stumbles upon an old diary and recollects the childhood school memories and his music teacher Clement Mathieu.", The Chorus,pierre a successful orchestra conductor returns home when his mother dies he stumbles upon an old diary and recollects the childhood school memories and his music teacher clement mathieu
744,1973,2h 3m,X,7.8,(47K),,A series of comedic and nostalgic vignettes set in a 1930s Italian coastal town., Amarcord,a series of comedic and nostalgic vignettes set in a s italian coastal town
745,1967,2h 35m,U,7.8,(26K),99.0,"Monsieur Hulot curiously wanders around a high-tech Paris, paralleling a trip with a group of American tourists. Meanwhile, a nightclub/restaurant prepares its opening night, but it's still under construction.", Playtime,monsieur hulot curiously wanders around a hightech paris paralleling a trip with a group of american tourists meanwhile a nightclubrestaurant prepares its opening night but its still under construction
746,2015,1h 40m,15,7.8,(46K),75.0,"In post-World War II Denmark, a group of young German POWs are forced to clear a beach of thousands of land mines under the watch of a Danish Sergeant who slowly learns to appreciate their plight.", Land of Mine,in postworld war ii denmark a group of young german pows are forced to clear a beach of thousands of land mines under the watch of a danish sergeant who slowly learns to appreciate their plight
747,2016,1h 40m,15,7.8,(65K),78.0,"After surviving a heart-attack, a 59-year-old carpenter must fight bureaucratic forces to receive Employment and Support Allowance."," I, Daniel Blake",after surviving a heartattack a yearold carpenter must fight bureaucratic forces to receive employment and support allowance
748,1946,1h 58m,PG,7.8,(27K),90.0,"A humble orphan boy in 1810s Kent is given the opportunity to go to London and become a gentleman, with the help of an unknown benefactor.", Great Expectations,a humble orphan boy in s kent is given the opportunity to go to london and become a gentleman with the help of an unknown benefactor
749,2011,2h 37m,15,7.8,(51K),82.0,A group of men set out in search of a dead body in the Anatolian steppes., Once Upon a Time in Anatolia,a group of men set out in search of a dead body in the anatolian steppes
750,2004,3h 12m,U,7.8,(58K),67.0,"""Veer-Zaara"" is a saga of love, separation, courage, and sacrifice. A love story that is an inspiration and will remain a legend forever.", Veer Zaara,veerzaara is a saga of love separation courage and sacrifice a love story that is an inspiration and will remain a legend forever
751,2001,1h 27m,PG,7.8,(32K),70.0,A TV interviewer and his cameraman meet a former actress and travel through her memories and career., Millennium Actress,a tv interviewer and his cameraman meet a former actress and travel through her memories and career
752,1938,2h 6m,U,7.8,(28K),,The son of a snobbish Wall Street banker becomes engaged to a woman from a good-natured but decidedly eccentric family not realizing that his father is trying to force her family from their home for a real estate development., You Can't Take It with You,the son of a snobbish wall street banker becomes engaged to a woman from a goodnatured but decidedly eccentric family not realizing that his father is trying to force her family from their home for a real estate development
753,1972,1h 42m,AA,7.8,(47K),93.0,"A surreal, virtually plotless series of dreams centered around six middle-class people and their consistently interrupted attempts to have a meal together.", The Discreet Charm of the Bourgeoisie,a surreal virtually plotless series of dreams centered around six middleclass people and their consistently interrupted attempts to have a meal together
754,1959,1h 30m,PG,7.8,(36K),,A French actress filming an anti-war film in Hiroshima has an affair with a married Japanese architect as they share their differing perspectives on war., Hiroshima Mon Amour,a french actress filming an antiwar film in hiroshima has an affair with a married japanese architect as they share their differing perspectives on war
755,2013,2h 1m,PG,7.8,(28K),73.0,"Ryota is a successful workaholic businessman. When he learns that his biological son was switched with another boy after birth, he faces the difficult decision to choose his true son or the boy he and his wife have raised as their own."," Like Father, Like Son",ryota is a successful workaholic businessman when he learns that his biological son was switched with another boy after birth he faces the difficult decision to choose his true son or the boy he and his wife have raised as their own
756,1989,1h 44m,15,7.8,(61K),77.0,An ophthalmologist's mistress threatens to reveal their affair to his wife while a married documentary filmmaker is infatuated with another woman., Crimes and Misdemeanors,an ophthalmologists mistress threatens to reveal their affair to his wife while a married documentary filmmaker is infatuated with another woman
757,1992,1h 25m,U,7.8,(71K),64.0,The Muppets present their own touching rendition of Charles Dickens' classic tale., The Muppet Christmas Carol,the muppets present their own touching rendition of charles dickens classic tale
758,1997,1h 27m,Not Rated,7.8,(34K),,"Two terminally ill patients escape from a hospital, steal a car and rush towards the sea.", Knockin' on Heaven's Door,two terminally ill patients escape from a hospital steal a car and rush towards the sea
759,1962,1h 23m,X,7.8,(35K),,Twelve episodic tales in the life of a Parisian woman and her slow descent into prostitution., Vivre Sa Vie,twelve episodic tales in the life of a parisian woman and her slow descent into prostitution
760,1935,1h 36m,U,7.8,(35K),,A sly business manager and the wacky friends of two opera singers in Italy help them achieve success in America while humiliating their stuffy and snobbish enemies., A Night at the Opera,a sly business manager and the wacky friends of two opera singers in italy help them achieve success in america while humiliating their stuffy and snobbish enemies
761,2016,1h 6m,PG,7.8,(29K),85.0,"After losing his mother, a young boy is sent to an orphanage with other orphans his age where he begins to learn the meaning of trust and true love.", My Life as a Courgette,after losing his mother a young boy is sent to an orphanage with other orphans his age where he begins to learn the meaning of trust and true love
762,2005,2h 9m,15,7.8,(34K),81.0,"A young French Canadian, one of five boys in a conservative family in the 1960s and 1970s, struggles to reconcile his emerging identity with his father's values.", C,a young french canadian one of five boys in a conservative family in the s and s struggles to reconcile his emerging identity with his fathers values
763,2017,2h 12m,PG,7.8,(32K),,A couple from Chandni Chowk aspire to give their daughter the best education and thus be a part of and accepted by the elite of Delhi., Hindi Medium,a couple from chandni chowk aspire to give their daughter the best education and thus be a part of and accepted by the elite of delhi
764,2012,2h 14m,PG,7.8,(40K),,"A quiet, sweet tempered housewife endures small slights from her well-educated husband and daughter every day because of her inability to speak and understand English.", English Vinglish,a quiet sweet tempered housewife endures small slights from her welleducated husband and daughter every day because of her inability to speak and understand english
765,2012,2h 6m,12A,7.8,(45K),,"A man is brought in by an infertility doctor to supply him with his sperm, where he becomes the biggest sperm donor for his clinic.", Vicky Donor,a man is brought in by an infertility doctor to supply him with his sperm where he becomes the biggest sperm donor for his clinic
766,2001,1h 35m,15,7.7,(37K),85.0,A gender-queer punk-rock singer from East Berlin tours the U.S. with her band as she tells her life story and follows the former lover/band-mate who stole her songs., Hedwig and the Angry Inch,a genderqueer punkrock singer from east berlin tours the us with her band as she tells her life story and follows the former loverbandmate who stole her songs
767,1962,2h 58m,PG,7.7,(60K),75.0,"The events of D-Day, told on a grand scale from both the Allied and German points of view.", The Longest Day,the events of dday told on a grand scale from both the allied and german points of view
768,2023,2h 31m,15,7.7,(134K),86.0,A woman is suspected of murder after her husband's death; their half-blind son faces a moral dilemma as the main witness., Anatomy of a Fall,a woman is suspected of murder after her husbands death their halfblind son faces a moral dilemma as the main witness
769,2023,2h 43m,12A,7.7,(253K),81.0,Ethan Hunt and his IMF team must track down a dangerous weapon before it falls into the wrong hands., Mission: Impossible - Dead Reckoning Part One,ethan hunt and his imf team must track down a dangerous weapon before it falls into the wrong hands
770,2023,2h 49m,15,7.7,(339K),78.0,"John Wick uncovers a path to defeating The High Table. But before he can earn his freedom, Wick must face off against a new enemy with powerful alliances across the globe and forces that turn old friends into foes.", John Wick: Chapter 4,john wick uncovers a path to defeating the high table but before he can earn his freedom wick must face off against a new enemy with powerful alliances across the globe and forces that turn old friends into foes
771,2023,1h 45m,15,7.7,(52K),90.0,A screenwriter drawn back to his childhood home enters into a fledgling relationship with his downstairs neighbor while discovering a mysterious new way to heal from losing his parents 30 years ago., All of Us Strangers,a screenwriter drawn back to his childhood home enters into a fledgling relationship with his downstairs neighbor while discovering a mysterious new way to heal from losing his parents years ago
772,1985,1h 54m,12A,7.7,(300K),62.0,A group of young misfits called The Goonies discover an ancient map and set out on an adventure to find a legendary pirate's long-lost treasure., The Goonies,a group of young misfits called the goonies discover an ancient map and set out on an adventure to find a legendary pirates longlost treasure
773,2015,2h 1m,15,7.7,(481K),82.0,An idealistic FBI agent is enlisted by a government task force to aid in the escalating war against drugs at the border area between the U.S. and Mexico., Sicario,an idealistic fbi agent is enlisted by a government task force to aid in the escalating war against drugs at the border area between the us and mexico
774,2014,2h 9m,15,7.7,(719K),60.0,"A spy organisation recruits a promising street kid into the agency's training program, while a global threat emerges from a twisted tech genius.", Kingsman: The Secret Service,a spy organisation recruits a promising street kid into the agencys training program while a global threat emerges from a twisted tech genius
775,2005,2h 14m,15,7.7,(385K),87.0,Ennis and Jack are two shepherds who develop a sexual and emotional relationship. Their relationship becomes complicated when both of them get married to their respective girlfriends., Brokeback Mountain,ennis and jack are two shepherds who develop a sexual and emotional relationship their relationship becomes complicated when both of them get married to their respective girlfriends
776,2009,1h 40m,18,7.7,(851K),73.0,"Three buddies wake up from a bachelor party in Las Vegas, with no memory of the previous night and the bachelor missing. They make their way around the city in order to find their friend before his wedding.", The Hangover,three buddies wake up from a bachelor party in las vegas with no memory of the previous night and the bachelor missing they make their way around the city in order to find their friend before his wedding
777,1986,2h 10m,18,7.7,(118K),54.0,An intellectually nonconformist friar investigates a series of mysterious deaths in an isolated abbey., The Name of the Rose,an intellectually nonconformist friar investigates a series of mysterious deaths in an isolated abbey
778,2014,1h 48m,15,7.7,(595K),78.0,A young programmer is selected to participate in a ground-breaking experiment in synthetic intelligence by evaluating the human qualities of a highly advanced humanoid A.I., Ex Machina,a young programmer is selected to participate in a groundbreaking experiment in synthetic intelligence by evaluating the human qualities of a highly advanced humanoid ai
779,2014,1h 40m,U,7.7,(390K),83.0,"An ordinary LEGO construction worker, thought to be the prophesied as ""special"", is recruited to join a quest to stop an evil tyrant from gluing the LEGO universe into eternal stasis.", The Lego Movie,an ordinary lego construction worker thought to be the prophesied as special is recruited to join a quest to stop an evil tyrant from gluing the lego universe into eternal stasis
